{
  "schema_version": "1.0.0",
  "deal_id": "moll-burbank-portfolio",
  "archive": [
    {
      "id": "905-n-3rd:img-001",
      "filename": "905-n-3rd-905-n-3rd-exterior-front-entry.jpg",
      "sha256": "11daf69a7cfd32bfbc3fc708d70f834d9b5f05f8d36c4971fb031b3bdbfae35e",
      "phash": "98e19e6965a9a99a",
      "source": "listing_portal",
      "source_url": "https://images1.apartments.com/i2/1HRTYM8cPsZ4EbU4wEu7jKAkhsBLPimFPNtopjbytes/116/image.jpg",
      "access_date": "2026-09-22",
      "category": "exterior",
      "width": 1732,
      "height": 1154,
      "stock_or_illustrative": false,
      "stock_basis": null,
      "property_match": "confirmed_human",
      "match_basis": "Tudor half-timber gable with brick end walls, two stories, glass lobby entry under a canopy lettered '905'; matches Google Street View pano CytqQicnLSQVrhBj8xMexQ (07/2024) of the N 3rd St frontage and the satellite footprint on APN 2460-006-050. Hero.",
      "reviewed_by": "Claude for the LAAA Team, under Glen's standing photo rule (2026-08-07)",
      "reviewed_at": "2026-09-22T15:38:22-07:00",
      "rights_holder": "Listing photographer, via Apartments.com rental listing for 905 N 3rd St Unit 108 (26 photos)",
      "publication_basis": "glen_standing_rule",
      "usage_scope": "Seller-facing BOV website for this property",
      "required_credit": null,
      "status": "published",
      "rejected_reason": null,
      "rendered_width": 1732,
      "rendered_height": 1154,
      "exception_id": null
    },
    {
      "id": "905-n-3rd:img-002",
      "filename": "905-n-3rd-905-n-3rd-front-lawn-and-walk.jpg",
      "sha256": "3783564f4ddbfecda83b7209412554175860973ad731cc0240888115f99e93bf",
      "phash": "96afd87c6c06a42d",
      "source": "listing_portal",
      "source_url": "https://images1.apartments.com/i2/OQfZH2j00HYE_ZGN1x8711_LdcQvmQ88jnOQVEPXK24/116/image.jpg",
      "access_date": "2026-09-22",
      "category": "exterior",
      "width": 1732,
      "height": 1154,
      "stock_or_illustrative": false,
      "stock_basis": null,
      "property_match": "confirmed_human",
      "match_basis": "Front lawn and walk beside the same Tudor facade with brick end wall, balconies and hedge; same shoot as img-001; lawn strip along N 3rd St matches Street View.",
      "reviewed_by": "Claude for the LAAA Team, under Glen's standing photo rule (2026-08-07)",
      "reviewed_at": "2026-09-22T15:38:22-07:00",
      "rights_holder": "Listing photographer, via Apartments.com rental listing for 905 N 3rd St Unit 108 (26 photos)",
      "publication_basis": "glen_standing_rule",
      "usage_scope": "Seller-facing BOV website for this property",
      "required_credit": null,
      "status": "published",
      "rejected_reason": null,
      "rendered_width": 1732,
      "rendered_height": 1154,
      "exception_id": null
    },
    {
      "id": "905-n-3rd:img-003",
      "filename": "905-n-3rd-905-n-3rd-aerial-front.jpg",
      "sha256": "2bff6a7b399b8901126587a2b5d637c04e869d7a8125d708f84b8559e03a672e",
      "phash": "e594c37f5ae23340",
      "source": "listing_portal",
      "source_url": "https://photos.zillowstatic.com/fp/be31666f47b8a48632eebd8c70d6917b-uncropped_scaled_within_1536_1152.jpg",
      "access_date": "2026-09-22",
      "category": "aerial",
      "width": 1536,
      "height": 851,
      "stock_or_illustrative": false,
      "stock_basis": null,
      "property_match": "confirmed_human",
      "match_basis": "Drone view of the Tudor gabled front, lawn and walk on N 3rd St with the flat-roof courtyard wings behind; footprint matches the satellite outline of APN 2460-006-050.",
      "reviewed_by": "Claude for the LAAA Team, under Glen's standing photo rule (2026-08-07)",
      "reviewed_at": "2026-09-22T15:38:22-07:00",
      "rights_holder": "Listing photographer, via Trulia rental listing for 905 N 3rd St #210 (24-photo gallery, 12 unique shots)",
      "publication_basis": "glen_standing_rule",
      "usage_scope": "Seller-facing BOV website for this property",
      "required_credit": null,
      "status": "published",
      "rejected_reason": null,
      "rendered_width": 1536,
      "rendered_height": 851,
      "exception_id": null
    },
    {
      "id": "905-n-3rd:img-004",
      "filename": "905-n-3rd-905-n-3rd-courtyard.jpg",
      "sha256": "fbb800e661aaf87b894f43e8e4307576b9827097e5dccf950289abbe651c1354",
      "phash": "c69df36f34036cc0",
      "source": "listing_portal",
      "source_url": "https://images1.apartments.com/i2/73f0dZaW5TocX4oVrofKfqJWOaYYY-97VNyo4db7UDo/116/image.jpg",
      "access_date": "2026-09-22",
      "category": "courtyard",
      "width": 1732,
      "height": 1154,
      "stock_or_illustrative": false,
      "stock_basis": null,
      "property_match": "confirmed_human",
      "match_basis": "Center courtyard with twin stairs, brick planters and the pool beyond; same professional shoot as the verified exterior (same lobby, courtyard, blue umbrella pool furniture); the pool courtyard matches the pool visible inside the 905 parcel line on the satellite view.",
      "reviewed_by": "Claude for the LAAA Team, under Glen's standing photo rule (2026-08-07)",
      "reviewed_at": "2026-09-22T15:38:22-07:00",
      "rights_holder": "Listing photographer, via Apartments.com rental listing for 905 N 3rd St Unit 108 (26 photos)",
      "publication_basis": "glen_standing_rule",
      "usage_scope": "Seller-facing BOV website for this property",
      "required_credit": null,
      "status": "published",
      "rejected_reason": null,
      "rendered_width": 1732,
      "rendered_height": 1154,
      "exception_id": null
    },
    {
      "id": "905-n-3rd:img-005",
      "filename": "905-n-3rd-905-n-3rd-upper-walkway.jpg",
      "sha256": "41f58d448421ae7b4a1d9ccddb467899cb81af97c4029a8ec9c042f1fb27250e",
      "phash": "8fc4dc7cc0c9a669",
      "source": "listing_portal",
      "source_url": "https://images1.apartments.com/i2/2ep6IYqvdHusRhgYG3vsqkG1bYU_Vm_Qouot0mQUMO8/116/image.jpg",
      "access_date": "2026-09-22",
      "category": "courtyard",
      "width": 2048,
      "height": 1365,
      "stock_or_illustrative": false,
      "stock_basis": null,
      "property_match": "confirmed_human",
      "match_basis": "Second-floor walkway over the courtyard; same professional shoot as the verified exterior (same lobby, courtyard, blue umbrella pool furniture); the pool courtyard matches the pool visible inside the 905 parcel line on the satellite view.",
      "reviewed_by": "Claude for the LAAA Team, under Glen's standing photo rule (2026-08-07)",
      "reviewed_at": "2026-09-22T15:38:22-07:00",
      "rights_holder": "Listing photographer, via Apartments.com rental listing for 905 N 3rd St Unit 108 (26 photos)",
      "publication_basis": "glen_standing_rule",
      "usage_scope": "Seller-facing BOV website for this property",
      "required_credit": null,
      "status": "published",
      "rejected_reason": null,
      "rendered_width": 2048,
      "rendered_height": 1365,
      "exception_id": null
    },
    {
      "id": "905-n-3rd:img-006",
      "filename": "905-n-3rd-905-n-3rd-courtyard-bbq.jpg",
      "sha256": "0e6fcfd3a376be05eac8c6e54d21dd8451906a49c93e3bd6642ad2f3d5c90107",
      "phash": "928d7b14aae9d4ca",
      "source": "listing_portal",
      "source_url": "https://images1.apartments.com/i2/SeAK227iXRx18xA-5nqXob5PAysBkdzdhcqxAY0nt1U/116/image.jpg",
      "access_date": "2026-09-22",
      "category": "courtyard",
      "width": 1732,
      "height": 1154,
      "stock_or_illustrative": false,
      "stock_basis": null,
      "property_match": "confirmed_human",
      "match_basis": "Brick BBQ and bench courtyard between the stair runs; same professional shoot as the verified exterior (same lobby, courtyard, blue umbrella pool furniture); the pool courtyard matches the pool visible inside the 905 parcel line on the satellite view.",
      "reviewed_by": "Claude for the LAAA Team, under Glen's standing photo rule (2026-08-07)",
      "reviewed_at": "2026-09-22T15:38:22-07:00",
      "rights_holder": "Listing photographer, via Apartments.com rental listing for 905 N 3rd St Unit 108 (26 photos)",
      "publication_basis": "glen_standing_rule",
      "usage_scope": "Seller-facing BOV website for this property",
      "required_credit": null,
      "status": "published",
      "rejected_reason": null,
      "rendered_width": 1732,
      "rendered_height": 1154,
      "exception_id": null
    },
    {
      "id": "905-n-3rd:img-007",
      "filename": "905-n-3rd-905-n-3rd-pool.jpg",
      "sha256": "b23541a4e124958cd6607474812a6339925d8d60b940e84e9b98aaaec0029e13",
      "phash": "bfcb4cb2a3027ad0",
      "source": "listing_portal",
      "source_url": "https://images1.apartments.com/i2/MOG16hUGhN-hA219XGqdMSpCvbrEeSLivQFM1hqjZW4/116/image.jpg",
      "access_date": "2026-09-22",
      "category": "pool",
      "width": 1731,
      "height": 1154,
      "stock_or_illustrative": false,
      "stock_basis": null,
      "property_match": "confirmed_human",
      "match_basis": "Pool in the U-shaped two-story courtyard; same professional shoot as the verified exterior (same lobby, courtyard, blue umbrella pool furniture); the pool courtyard matches the pool visible inside the 905 parcel line on the satellite view.",
      "reviewed_by": "Claude for the LAAA Team, under Glen's standing photo rule (2026-08-07)",
      "reviewed_at": "2026-09-22T15:38:22-07:00",
      "rights_holder": "Listing photographer, via Apartments.com rental listing for 905 N 3rd St Unit 108 (26 photos)",
      "publication_basis": "glen_standing_rule",
      "usage_scope": "Seller-facing BOV website for this property",
      "required_credit": null,
      "status": "published",
      "rejected_reason": null,
      "rendered_width": 1731,
      "rendered_height": 1154,
      "exception_id": null
    },
    {
      "id": "905-n-3rd:img-008",